{
  "schema_version": "0.1",
  "client_operation_id": "operation_bind_ambiguous_01",
  "request_digest": "6123456789abcdef0123456789abcdef0123456789abcdef0123456789abcdef",
  "run_id": "run_01",
  "lease_id": "lease_01",
  "binding": {
    "binding_id": "binding_pid_01",
    "identity_kind": "process",
    "identity_ref": "pid_123",
    "valid_from_unix_ms": 1783891200000,
    "valid_until_unix_ms": null,
    "evidence_basis": "heuristic_match",
    "evidence_basis_ref": "pid_time_match_01",
    "attribution": "ambiguous",
    "reason_codes": ["pid_reuse_possible", "clock_uncertainty"],
    "confidence_bps": null,
    "alternative_runtime_candidates": [
      {
        "identity_ref": "pid_456",
        "reason_codes": ["same_executable", "overlapping_time_window"],
        "confidence_bps": 6400,
        "evidence_basis_refs": ["process_snapshot_02"]
      }
    ]
  }
}
